[
  {
    "observer_id": "direction",
    "theme_id": "semiconductors",
    "as_of_utc": "2026-08-10T19:45:00Z",
    "state": "unresolved",
    "eligible": false,
    "uncertainty": null,
    "evidence_refs": [
      "synthetic:data_blocked:direction"
    ],
    "metrics": {},
    "invalidation": "Synthetic invalidation condition.",
    "notes": null,
    "data_ready": false,
    "model_estimated": false,
    "decision_eligible": false,
    "source_version": null,
    "source_sha256": null
  },
  {
    "observer_id": "transmission",
    "theme_id": "semiconductors",
    "as_of_utc": "2026-08-10T19:45:00Z",
    "state": "not_estimable",
    "eligible": false,
    "uncertainty": null,
    "evidence_refs": [
      "synthetic:data_blocked:transmission"
    ],
    "metrics": {},
    "invalidation": "Synthetic invalidation condition.",
    "notes": null,
    "data_ready": false,
    "model_estimated": false,
    "decision_eligible": false,
    "source_version": null,
    "source_sha256": null
  },
  {
    "observer_id": "episode",
    "theme_id": "semiconductors",
    "as_of_utc": "2026-08-10T19:45:00Z",
    "state": "not_estimable",
    "eligible": false,
    "uncertainty": null,
    "evidence_refs": [
      "synthetic:data_blocked:episode"
    ],
    "metrics": {},
    "invalidation": "Synthetic invalidation condition.",
    "notes": null,
    "data_ready": false,
    "model_estimated": false,
    "decision_eligible": false,
    "source_version": null,
    "source_sha256": null
  },
  {
    "observer_id": "theme_radar_attention",
    "theme_id": "semiconductors",
    "as_of_utc": "2026-08-10T19:45:00Z",
    "state": "not_available",
    "eligible": true,
    "uncertainty": 0.2,
    "evidence_refs": [
      "synthetic:data_blocked:theme_radar_attention"
    ],
    "metrics": {},
    "invalidation": "Synthetic invalidation condition.",
    "notes": null,
    "data_ready": true,
    "model_estimated": true,
    "decision_eligible": false,
    "source_version": null,
    "source_sha256": null
  },
  {
    "observer_id": "fragility",
    "theme_id": "semiconductors",
    "as_of_utc": "2026-08-10T19:45:00Z",
    "state": "unknown",
    "eligible": false,
    "uncertainty": null,
    "evidence_refs": [
      "synthetic:data_blocked:fragility"
    ],
    "metrics": {},
    "invalidation": "Synthetic invalidation condition.",
    "notes": null,
    "data_ready": false,
    "model_estimated": false,
    "decision_eligible": false,
    "source_version": null,
    "source_sha256": null
  }
]
